<?xml version="1.0" encoding="UTF-8"?>
<!DOCTYPE aircraft-carrier SYSTEM "AircraftCarrier.dtd">
<?xml-stylesheet type="text/xsl" href="XML_Transformation_2.xsl"?>

<aircraft-carrier engine = "diesel" class = "Shōkaku-class" years-of-service = "1941-1944">
	<name>Shōkaku</name>
	<personel>
		<soldier id = "s1" aircraft = "a1" battle = "b1 b2 b3">
			<first-name>Такижиро</first-name>
			<last-name>Охниши</last-name>
			<gender>мъж</gender>
			<position>пилот</position>
			<age>46</age>
			<religion>шинто</religion>
		</soldier>
		<soldier id = "s2" battle = "b1 b2">
			<first-name>Исороку</first-name>
			<last-name>Ямамато</last-name>
			<gender>мъж</gender>
			<position>адмирал</position>
			<age>58</age>
			<religion>шинто</religion>
		</soldier>
		<soldier id = "s3" battle = "b2 b3 b4">
			<first-name>Нобутаке</first-name>
			<last-name>Кондо</last-name>
			<gender>мъж</gender>
			<position>адмирал</position>
			<age>66</age>
			<religion>будизъм</religion>
		</soldier>
		<soldier id = "s4" battle = "a1">
			<first-name>Чучи</first-name>
			<last-name>Нагумо</last-name>
			<gender>мъж</gender>
			<position>адмирал</position>
			<age>57</age>
			<religion>шинто</religion>
		</soldier>
		<soldier id = "s5" aircraft = "a1">
			<first-name>Тамон</first-name>
			<last-name>Ямагучи</last-name>
			<gender>мъж</gender>
			<position>адмирал</position>
			<age>49</age>
			<religion>шинто</religion>
		</soldier>
		<soldier id = "s6" aircraft = "a1">
			<first-name>Руйсако</first-name>
			<last-name>Янагимото</last-name>
			<gender>мъж</gender>
			<position>адмирал</position>
			<age>47</age>
			<religion>будизъм</religion>
		</soldier>
	</personel>
	<aircrafts>
		<aircraft id = "a1" control = "pilot" role = "fighter" manufacturer="m1" battle = "b2 b4 b5">
			<model>Мицубиши A6M Zero</model>
			<cost>$200000</cost>
			<specifications>
				<crew>1</crew>
				<range>3105 км</range>
				<weight>1680 кг</weight>
			</specifications>
		</aircraft>
		<aircraft id = "a2" control = "pilot" role = "bomber" manufacturer="m2" battle = "b1 b2 b3 b4">
			<model>Aichi D3A1</model>
			<cost>$200000</cost>
			<specifications>
				<crew>2</crew>
				<range>1472 км</range>
				<weight>3650 кг</weight>
			</specifications>
		</aircraft>
		<aircraft id = "a3" control = "pilot" role = "bomber" manufacturer="m3" battle = "b1 b3 b5">
			<model>Nakajima B5N</model>
			<cost>$220000</cost>
			<specifications>
				<crew>3</crew>
				<range>1992 км</range>
				<weight>2279 кг</weight>
			</specifications>
		</aircraft>
	</aircrafts>
	<battles>
		<battle id="b1">
			<battle-name>Пърл Харбър</battle-name>
			<countries>
				<country continent="asia">
					<country-name>Съединени американски щати</country-name>
					<population>313 милиона</population>
				</country>
			</countries>
			<duration>един ден</duration>
			<description>Нападението над Пърл Харбър е изненадваща въздушна атака на японския Императорски флот срещу американската военноморска база при Пърл Харбър, Хаваи, извършена сутринта на 7 декември 1941 г.
				Без предварително обявяване на война базата е атакувана от 353 японски бойни самолети, бомбардировачи и торпедоносци на две вълни, изстрелвани от шест самолетоносача. Унищожена е голяма част от американския тихоокеански военноморски флот.
				Атаката е повратна точка в развоя на Втората световна война, тъй като става повод за влизането на САЩ, която да този момент е неутрална, във войната. Въпреки, че атаката причинява на САЩ значителни военни загуби, тя се оказва с фатални последствия за Япония. На следващия ден (8 декември) САЩ обявява война на Япония.
			</description>
			<units-lost></units-lost>
		</battle>
		<battle id="b2">
			<battle-name>Битка при Мидуей</battle-name>
			<countries>
				<country continent="asia">
					<country-name>Съединени американски щати</country-name>
					<population>313 милиона</population>
				</country>
			</countries>
			<duration>три дни</duration>
			<description>
				Битката при атола Мидуей се състои на 4 юни 1942 година и е една от най-значителните морски битки на Втората световна война. Флотът на САЩ побеждава обединения флот на Япония, който атакува атола Мидуей. Битката бележи повратен момент във войната в Тихия океан. Обединеният флот на Япония губи 4 тежки самолетоносача, 250 самолета и най-добрите си пилоти, с което загубва възможностите си да действа извън зоната на прикритие на бреговата авиация.
			</description>
			<units-lost></units-lost>
		</battle>
		<battle id="b3">
			<battle-name>Битката при островите Санта Круз</battle-name>
			<countries>
				<country continent="asia">
					<country-name>Съединени американски щати</country-name>
					<population>313 милиона</population>
				</country>
			</countries>
			<duration>три дни</duration>
			<description>
				Битката при атола Мидуей се състои на 4 юни 1942 година и е една от най-значителните морски битки на Втората световна война. Флотът на САЩ побеждава обединения флот на Япония, който атакува атола Мидуей. Битката бележи повратен момент във войната в Тихия океан. Обединеният флот на Япония губи 4 тежки самолетоносача, 250 самолета и най-добрите си пилоти, с което загубва възможностите си да действа извън зоната на прикритие на бреговата авиация.
			</description>
			<units-lost></units-lost>
		</battle>
		<battle id="b4">
			<battle-name>Битката за Иво Джима</battle-name>
			<countries>
				<country continent="asia">
					<country-name>Съединени американски щати</country-name>
					<population>313 милиона</population>
				</country>
			</countries>
			<duration>три дни</duration>
			<description>
				Битката при атола Мидуей се състои на 4 юни 1942 година и е една от най-значителните морски битки на Втората световна война. Флотът на САЩ побеждава обединения флот на Япония, който атакува атола Мидуей. Битката бележи повратен момент във войната в Тихия океан. Обединеният флот на Япония губи 4 тежки самолетоносача, 250 самолета и най-добрите си пилоти, с което загубва възможностите си да действа извън зоната на прикритие на бреговата авиация.
			</description>
			<units-lost></units-lost>
		</battle>
		<battle id="b5">
			<battle-name>Битка в Коралово море</battle-name>
			<countries>
				<country continent="asia">
					<country-name>Австралия</country-name>
					<population>22117876</population>
				</country>
			</countries>
			<duration>четири дни</duration>
			<description>
				Битката в Коралово море е морско сражение, състояло се на 6 - 8 май 1942 г. в Тихия океан между сили на Япония и САЩ през Втората световна война. Това е първата в историята морска битка, в която от двете страни участва само палубна авиация.
			</description>
			<units-lost></units-lost>
		</battle>
	</battles>
	<manufacturers>
		<manufacturer id="m1">
			<manufacturer-name>Mitsubishi Heavy Industries</manufacturer-name>
			<established>1914</established>
			<staff-count>63500</staff-count>
			<profit>$300 милиона</profit>
		</manufacturer>
		<manufacturer id="m2">
			<manufacturer-name>Aichi Aircraft Company</manufacturer-name>
			<established>1898</established>
			<staff-count>4000</staff-count>
			<profit>$300 милиона</profit>
		</manufacturer>
		<manufacturer id="m3">
			<manufacturer-name>Nakajima Aircraft Company</manufacturer-name>
			<established>1918</established>
			<staff-count>4000</staff-count>
			<profit>$300 милиона</profit>
		</manufacturer>
	</manufacturers>
</aircraft-carrier>